{
  "schema_version": "1.1.0",
  "manifest_version": "1.1.0",
  "feature_set": "market-basic",
  "feature_set_version": "1.0.0",
  "feature_names": ["close", "return_1d", "range_1d", "volume"],
  "artifact": {
    "artifact_id": "00000000-0000-0000-0000-000000000005",
    "artifact_version": "1.1.0",
    "generator_version": "contract-fixture",
    "git_commit": "unknown",
    "created_at": "2026-08-12T14:30:01Z"
  },
  "calendar_pin": {
    "data_source_id": "00000000-0000-0000-0000-000000000006",
    "mic": "XNAS",
    "calendar_version": "xnas_2026_fixture",
    "session_fingerprint": "eeeeeeeeeeeeeeeeeeeeeeeeeeeeeeeeeeeeeeeeeeeeeeeeeeeeeeeeeeeeeeee",
    "calendar_available_at": "2026-08-12T14:28:00Z",
    "decision_clock_policy": "after_close_next_session"
  },
  "decision_at": "2026-08-12T14:30:00Z",
  "input_available_at": "2026-08-12T14:29:00Z",
  "computation_delay_seconds": 30,
  "available_at": "2026-08-12T14:29:30Z",
  "input_fingerprint": "a770b541847109bb637de61fa50b106558ef46e8a64fb3d9b7a54dec25e3458e",
  "selected_input_manifests": [
    {
      "path": "data/normalized/price-bars/source=yahoo/security=00000000-0000-0000-0000-000000000001/manifest.json",
      "sha256": "bbbbbbbbbbbbbbbbbbbbbbbbbbbbbbbbbbbbbbbbbbbbbbbbbbbbbbbbbbbbbbbb"
    }
  ],
  "selected_input_parts": [
    {
      "path": "part-cccccccccccccccccccccccccccccccccccccccccccccccccccccccccccccccc.parquet",
      "sha256": "cccccccccccccccccccccccccccccccccccccccccccccccccccccccccccccccc"
    }
  ],
  "row_count": 1,
  "parts": [
    {
      "path": "part-dddddddddddddddddddddddddddddddddddddddddddddddddddddddddddddddd.parquet",
      "sha256": "dddddddddddddddddddddddddddddddddddddddddddddddddddddddddddddddd",
      "row_count": 1
    }
  ]
}
